{
  "schema": 1,
  "id": "syne",
  "name": "SYNE",
  "type": "simulation",
  "version": "0.16.0",
  "protocolVersion": 1,
  "runtime": "dotnet",
  "executable": {
    "linux": "Simulation.Console/bin/Release/net10.0/publish/Simulation.Console",
    "windows": "Simulation.Console/bin/Release/net10.0/win-x64/publish/Simulation.Console.exe"
  },
  "workingDirectory": ".",
  "endpoints": {
    "control": {
      "transport": "http",
      "port": 5181,
      "enabled": true,
      "launchArgument": "--control-port"
    },
    "ws": {
      "transport": "websocket",
      "port": 5180,
      "enabled": true,
      "launchArgument": "--observe-port"
    }
  },
  "capabilities": [
    "headless",
    "control",
    "observability",
    "batch"
  ],
  "health": {
    "probe": "http",
    "path": "/health/ready",
    "intervalMs": 500
  },
  "timeouts": {
    "startupMs": 30000,
    "shutdownMs": 15000
  }
}
